[
  {
    "id": "sch-jackie-robinson-foundation",
    "title": "Jackie Robinson Foundation Scholarship",
    "provider": "Jackie Robinson Foundation (New York, NY)",
    "url": "https://jackierobinson.org/apply/",
    "source_url": "https://jackierobinson.org/apply/",
    "summary": "Up to $35,000 over four years plus mentoring for graduating high school seniors with financial need who will attend a four-year college. Run by a New York City foundation and open to students nationwide.",
    "school_levels": ["HS"],
    "eligibility": {
      "class_years": ["hs_12"],
      "min_gpa": null,
      "max_age": null,
      "citizenship": ["us_citizen"],
      "majors": [],
      "identity_groups": [],
      "need_based": true,
      "nyc_only": false,
      "geo_scope": "national",
      "geo_areas": ["US"],
      "enrolled_at": [],
      "prerequisites": []
    },
    "focus_tags": ["leadership", "community-service", "financial-need", "mentoring", "four-year-college"],
    "evidence": [
      { "field": "deadline", "quote": "The application, letter of recommendation, and CSS Profile are due by 5:00 p.m. EST on Thursday, January 14, 2027." },
      { "field": "eligibility", "quote": "Be a graduating high school senior." },
      { "field": "eligibility", "quote": "Be a United States citizen." },
      { "field": "eligibility", "quote": "Present evidence of financial need" },
      { "field": "amount", "quote": "JRF Scholars receive college scholarships of up to $35,000 over four years", "page": "https://jackierobinson.org/scholarship/" }
    ],
    "trust": { "badge": "web_verified", "checked_at": "2026-10-23", "note": "Deadline and eligibility from the 2026–27 application FAQ on the sponsor's site." },
    "is_sample": false,
    "extracted_at": "2026-10-23",
    "amount_min": null,
    "amount_max": 35000,
    "amount_period": "total_multi_year",
    "num_awards": null,
    "deadline": "2027-01-14",
    "requirements": {
      "essay": true,
      "recommendations": 1,
      "transcript": true,
      "interview": true,
      "application_fee": 0,
      "other": ["Three brief essays", "CSS Profile", "ACT or SAT score", "Finalist interviews April–May 2027"]
    },
    "is_sweepstakes": false,
    "published_applicants": null,
    "selection": "competitive",
    "est_pool": 4000,
    "est_pool_basis": "National default 5,000, shrunk ×0.8 for the U.S.-citizen + financial-need + four-year-college limits. Awards per year not published, so the formula uses num_awards = 1 (conservative)."
  },
  {
    "id": "sch-belle-zeller",
    "title": "Belle Zeller Scholarship",
    "provider": "Belle Zeller Scholarship Trust Fund (PSC-CUNY)",
    "url": "https://www.bellezeller.org/",
    "source_url": "https://www.bellezeller.org/",
    "summary": "$5,000 for CUNY students who combine academic excellence with community service. Open to undergraduates at CUNY community and senior colleges.",
    "school_levels": ["college"],
    "eligibility": {
      "class_years": [],
      "min_gpa": null,
      "max_age": null,
      "citizenship": [],
      "majors": [],
      "identity_groups": [],
      "need_based": false,
      "nyc_only": true,
      "geo_scope": "city",
      "geo_areas": ["NYC"],
      "enrolled_at": ["CUNY (any college)"],
      "prerequisites": []
    },
    "focus_tags": ["community-service", "volunteering", "academic-excellence", "cuny", "union"],
    "evidence": [
      { "field": "deadline", "quote": "Submission deadline is Friday, February 26, 2027." },
      { "field": "amount", "quote": "awards $5,000 scholarships to eligible CUNY students who demonstrate academic excellence and community service." },
      { "field": "eligibility", "quote": "Scholarships are awarded to undergraduate students from CUNY's many community and senior colleges" }
    ],
    "trust": { "badge": "web_verified", "checked_at": "2026-10-23", "note": "Past CUNY listings also required full-time enrollment, 16+ CUNY credits and a 3.75 GPA. Not on the 2027 page, so left blank; re-check when the 2027 form opens." },
    "is_sample": false,
    "extracted_at": "2026-10-23",
    "amount_min": 5000,
    "amount_max": 5000,
    "amount_period": "one_time",
    "num_awards": 10,
    "deadline": "2027-02-26",
    "requirements": {
      "essay": true,
      "recommendations": 2,
      "transcript": true,
      "interview": false,
      "application_fee": 0,
      "other": ["One recommendation from a CUNY instructor, one from a service supervisor"]
    },
    "is_sweepstakes": false,
    "published_applicants": null,
    "selection": "competitive",
    "est_pool": 250,
    "est_pool_basis": "A CUNY Graduate Center listing for the 2026 cycle said 'typically, 8–12 scholarships are granted from over 250 applications.' Using 250 applicants and 10 awards (≈1 in 25)."
  },
  {
    "id": "sch-paul-daisy-soros",
    "title": "Paul & Daisy Soros Fellowships for New Americans",
    "provider": "Paul & Daisy Soros Fellowships for New Americans (New York, NY)",
    "url": "https://pdsoros.org/apply",
    "source_url": "https://pdsoros.org/apply",
    "summary": "Up to $90,000 over two years of graduate school for immigrants and children of immigrants. College seniors applying to grad or professional school can apply. The application is free.",
    "school_levels": ["college"],
    "eligibility": {
      "class_years": ["college_4", "college_5plus", "grad"],
      "min_gpa": null,
      "max_age": 30,
      "citizenship": [],
      "majors": [],
      "identity_groups": ["immigrant-or-child-of-immigrants"],
      "need_based": false,
      "nyc_only": false,
      "geo_scope": "national",
      "geo_areas": ["US"],
      "enrolled_at": [],
      "prerequisites": []
    },
    "focus_tags": ["immigrant", "graduate-school", "fellowship"],
    "evidence": [
      { "field": "deadline", "quote": "The application for the 2027 fellowship is open and due on October 29, 2026 at 2 pm ET." },
      { "field": "eligibility", "quote": "your status as an immigrant or a child of immigrants" },
      { "field": "eligibility", "quote": "You can apply when you’re applying to graduate or professional school." },
      { "field": "requirements", "quote": "You can apply more than once and the application is free." },
      { "field": "amount", "quote": "Each Fellow receives up to $90,000 in financial support over two years", "page": "https://pdsoros.org/" },
      { "field": "amount", "quote": "Each year, we invest in the graduate education of 30 New Americans", "page": "https://pdsoros.org/" }
    ],
    "trust": { "badge": "web_verified", "checked_at": "2026-10-23", "note": "Deadline is Oct 29, 2026. If the demo is after that, the automatic checks will drop this listing." },
    "is_sample": false,
    "extracted_at": "2026-10-23",
    "amount_min": null,
    "amount_max": 90000,
    "amount_period": "total_multi_year",
    "num_awards": 30,
    "deadline": "2026-10-29",
    "requirements": {
      "essay": true,
      "recommendations": 3,
      "transcript": true,
      "interview": true,
      "application_fee": 0,
      "other": ["Finalist interviews late Jan–early Feb 2027"]
    },
    "is_sweepstakes": false,
    "published_applicants": null,
    "selection": "competitive",
    "est_pool": 2500,
    "est_pool_basis": "National default 5,000, ×0.5 for the immigrant-or-child-of-immigrants and age-30 limits. 30 fellows → ≈1 in 83 (Long shot)."
  },
  {
    "id": "sch-nyu-cas-durf",
    "title": "Dean's Undergraduate Research Fund (DURF) Research Grant",
    "provider": "NYU College of Arts and Science",
    "url": "https://studentresearchandfunding.nyu.edu/prog/research_grants_deans_undergraduate_research_fund_durf/",
    "source_url": "https://studentresearchandfunding.nyu.edu/prog/research_grants_deans_undergraduate_research_fund_durf/",
    "summary": "Up to $1,250 to fund your own research project, alone or as a team, with a faculty mentor. NYU College of Arts and Science students only.",
    "school_levels": ["college"],
    "eligibility": {
      "class_years": ["college_1", "college_2", "college_3", "college_4"],
      "min_gpa": null,
      "max_age": null,
      "citizenship": [],
      "majors": [],
      "identity_groups": [],
      "need_based": false,
      "nyc_only": false,
      "geo_scope": "city",
      "geo_areas": ["NYC"],
      "enrolled_at": ["New York University (College of Arts and Science)"],
      "prerequisites": []
    },
    "focus_tags": ["research", "faculty-mentor", "nyu"],
    "evidence": [
      { "field": "deadline", "quote": "Deadline Oct 28 2026 11:59 PM (EDT)" },
      { "field": "amount", "quote": "Applicants can receive up to $1,250 per grant for a Research Grant (either Individual or Team)." },
      { "field": "eligibility", "quote": "Applicants must be current first-years, sophomores, juniors, or first-term seniors in the College of Arts and Science" },
      { "field": "requirements", "quote": "Applications consist of a student submitted application and a letter of recommendation" }
    ],
    "trust": { "badge": "web_verified", "checked_at": "2026-10-23", "note": "Shown only to students who say they attend NYU CAS. DURF has a spring round too; re-import when it posts." },
    "is_sample": false,
    "extracted_at": "2026-10-23",
    "amount_min": null,
    "amount_max": 1250,
    "amount_period": "one_time",
    "num_awards": null,
    "deadline": "2026-10-28",
    "requirements": {
      "essay": true,
      "recommendations": 1,
      "transcript": false,
      "interview": false,
      "application_fee": 0,
      "other": ["Research proposal with budget"]
    },
    "is_sweepstakes": false,
    "published_applicants": null,
    "selection": "competitive",
    "est_pool": 150,
    "est_pool_basis": "One-school scope (treated like a county, ~40), scaled up for a large college. Hand estimate; NYU does not publish applicant counts."
  },
  {
    "id": "sch-boren-scholarship",
    "title": "Boren Scholarship (study abroad)",